final_sentence,grammar_score,coherence_score,word
The big red truck helped my friend fix her bike.,0.96,1,big
The small rabbit hopped quickly across the green grass.,0.97,1,small
The little rabbit wore a red bow on her head.,0.96,1,little
The largest fish in our aquarium is very large.,0.84,1,large
The artist used medium to create beautiful paintings slowly.,0.72,1,medium
"Here is a sentence that meets the requirements: ""The teacher calculates the average of the test scores."" This sentence includes the word ""average"" exactly as it is, and conveys a clear idea about calculating student scores in an",0.78,1,average
Here's a sentence that meets the requirements: The pencil measures one centimeter long exactly.,0.88,1,centimeter
The pencil lead broke because it was very short.,0.98,1,short
The company will shorten its summer break next year.,0.97,1,shorten
The longest day of summer vacation was very long.,0.84,1,long
The basketball player was tall and very strong.,0.87,1,tall
The picture of the house was drawn lengthwise on the paper.,0.8,1,lengthwise
The big box weighs very heavy on my back.,0.98,1,heavy
The scale shows the weight of my toy car.,0.97,1,weight
The scale will help us weigh the different types of food.,0.92,1,weigh
The kids made a big pile of leaves outside.,0.98,1,pile
The mail truck carries a heavy load every day.,0.98,1,load
The student felt pressure to do well on the test.,0.94,1,pressure
The scale in my science class weighs one kilogram.,0.97,1,kilogram
The pillow was very soft and comfortable to rest on.,0.87,1,soft
The rain helps to soften the dry earth slowly.,0.97,1,soften
"Here is a sentence that meets the requirements: Learning to ride a bike can be very hard. This sentence includes the word ""hard"" exactly as it is, without any changes or additional forms. It conveys a clear and simple",0.77,1,hard
The math test looked difficult for many of my classmates.,0.95,1,difficult
The gentle nurse held my hand very carefully today.,0.98,1,gentle
The plant's sensitive leaves need protection from strong winds.,0.95,1,sensitive
The teacher was strict about following classroom rules.,0.92,1,strict
The old book fell off the shelf yesterday.,0.99,1,old
"Here is a sentence that meets all the requirements: ""There were three puppies playing together outside."" This sentence includes the word ""three"" exactly as it is, conveys a clear and simple idea, and uses easy vocabulary and grammar suitable",0.79,1,three
The class has four students sitting together quietly.,0.98,1,four
The student had six pencils in her pencil case.,0.97,1,six
The teacher wrote seven numbers on the blackboard today.,0.96,1,seven
The eight students in my class are very happy.,0.84,1,eight
"This sentence meets the requirements: ""Today's class will meet at nine o'clock sharp always."" This sentence includes the word ""nine"" exactly as it is, and conveys a clear idea about the class schedule.",0.85,1,nine
"Here's a sentence that meets the requirements: ""The teacher counted ten students in her class."" This sentence is short, clear, and easy to understand for elementary school students in the US. It includes the word '",0.77,1,ten
The teacher gave eleven students a homework assignment.,0.98,1,eleven
Here's a sentence that meets the requirements: The cat was twelve years old today.,0.89,1,twelve
Here is a sentence that meets the requirements: There are thirteen students in my class today.,0.88,1,thirteen
The student in my class is fourteen years old.,0.84,1,fourteen
The teacher gave fifteen students extra recess time today.,0.96,1,fifteen
The temperature outside was sixteen degrees Celsius yesterday.,0.82,1,sixteen
"Here's a sentence that meets the requirements: ""Yesterday, I turned seventeen years old."" This sentence includes the word ""seventeen"" exactly as it is, conveys a simple idea about the speaker's age",0.8,1,seventeen
"Here is a sentence that meets the requirements: ""Yesterday I turned nineteen years old."" This sentence includes the word 'nineteen' exactly as it is, and conveys a clear idea of the speaker's",0.79,1,nineteen
"Here is a sentence that meets the requirements: ""After thirty days of homework, I finally finished my project."" This sentence includes the word 'thirty' exactly as it is, and conveys a single idea about how",0.81,1,thirty
The teacher asked us how old forty is.,1.0,1,forty
The cat slept for fifty minutes on my lap.,0.98,1,fifty
"Here's a sentence that meets all your requirements: ""The teacher wrote sixty names on the classroom board."" This sentence includes the word 'sixty' exactly as it is, without any changes or additional forms. It convey",0.77,1,sixty
The weatherman said it would be seventy degrees today.,0.96,1,seventy
"Here is a sentence that meets the requirements: ""The woman was eighty years old at that time."" This sentence includes the word 'eighty' exactly as it is, without any changes or additional forms. It conveys the",0.77,1,eighty
The student wrote ninety perfect papers on her test.,0.97,1,ninety
The teacher gave each student a hundred crayons.,0.98,1,hundred
"Here's a sentence that meets the requirements: ""The fireworks will shoot up a thousand feet high."" This sentence includes the word 'thousand' exactly as it is, is clear and simple, conveys a message",0.78,1,thousand
The class went on their eighth field trip today.,0.98,1,eighth
The fifth grade is a challenging but fun year.,0.82,1,fifth
The teacher will read a story aloud first.,1.0,1,first
The class has their ninth-grade field trip planned tomorrow.,0.95,1,ninth
"Here's a sentence that meets all the requirements: ""Please tell me what time it is for my second test."" This sentence includes the word ""second"" exactly as it is, is clear and simple, conveys a logical",0.8,1,second
The sun sets behind the third tree in our park.,0.95,1,third
The twelfth grade student had very little homework tonight.,0.96,1,twelfth
The twentieth day of the month was very special.,0.83,1,twentieth
The young girl loves playing outside in summer.,0.99,1,young
The new park has over a million visitors each year.,0.95,1,million
The company has a billion dollars in annual revenue.,0.96,1,billion
An adult always helps take care of their pet.,0.98,1,adult
The child's age will be 8 years old soon.,0.82,1,age
The teenager loves playing sports in her free time.,0.97,1,teenager
The youth are studying for their upcoming exams carefully.,0.96,1,youth
"Here's a 7-word sentence: ""When you double your money, you're rich."" This sentence is clear, simple, and easy to understand for an elementary school student in the US. It conveys the idea that when",0.8,1,double
The teacher gave the class a dozen pencils to share.,0.94,1,dozen
The elderly people need our help every day.,1.0,1,elderly
The teacher formed a trio of students to help with chores.,0.92,1,trio
"The triple threat of speed, skill, and teamwork works well.",0.96,1,triple
The chef carefully held a sharp knife in her hand.,0.95,1,knife
The girl carefully used scissors to cut the paper.,0.96,1,scissors
The scissors will cut through the thick string.,0.99,1,cut
The police officer kept his gun safely locked away.,0.98,1,gun
The brave knight used his sword to defend the kingdom.,0.95,1,sword
The pirate used his sword as a powerful weapon.,0.98,1,weapon
The sandwich needs a thin slice of turkey inside.,0.98,1,slice
The carpenter saw a big piece of wood on the floor.,0.92,1,saw
Please pack your lunch box for school today.,0.87,1,lunch box
The cat hid its toys in a small box.,0.98,1,box
The child blew up her balloon for the party.,0.97,1,balloon
The bell rings to signal the start of recess.,0.84,1,bell
The student drank from the bottle slowly.,0.99,1,bottle
The teacher placed a small tray on the desk.,0.97,1,tray
The students are looking forward to breakfast tomorrow morning.,0.95,1,breakfast
The kids were excited for their lunch today outside.,0.84,1,lunch
The family will eat together at dinner tonight.,0.99,1,dinner
The teacher gave us a healthy snack at recess today.,0.95,1,snack
"Here is a sentence that meets the requirements: ""The cafeteria serves food every morning at school."" This sentence includes the word 'food' exactly as it is, and conveys a clear idea about the time and place where",0.79,1,food
The sun rises in the morning sky.,0.99,1,morning
The teacher gave us homework after school in the afternoon.,0.94,1,afternoon
The family likes to watch TV in the evening.,0.97,1,evening
The stars shine brightly in the night sky.,0.99,1,night
My mom has breakfast every Saturday morning.,0.99,1,have breakfast
The class will have lunch at 12 o'clock today.,0.98,1,have lunch
The family will have dinner together tonight.,0.99,1,have dinner
"During the party, everyone loves to dance together.",1.0,1,dance
The little girl was a happy dancer.,0.87,1,dancer
The kids are going to the gym after school.,0.97,1,gym
The school soccer team joined a new sports club.,0.98,1,club
The drummer beats the drums very loudly outside.,0.99,1,beat
The kids love to run around in the park.,0.97,1,run
The kids are jogging around the neighborhood every Saturday.,0.94,1,jogging
The children will go for a walk around the park.,0.95,1,walk
"Here is a sentence that meets the requirements: ""The doctor recommends regular exercise for good health."" This sentence includes the word ""exercise"" exactly as it is, is clear and simple, conveys a logical idea about",0.78,1,exercise
"This sentence is clear, simple, and easy to understand for elementary school students in the US. It conveys a single idea (the girl trained and ran a marathon) and remains contextually coherent. The vocabulary and grammar used are age",0.75,1,run a marathon
"The path requires careful steps, so tread lightly outside.",0.96,1,tread
The cat tries to sneak into the kitchen quietly.,0.96,1,sneak
Students love to go skiing on weekends.,0.99,1,ski
My friends love skiing down the big snowy hills.,0.98,1,skiing
"Here is a sentence that meets the requirements: ""My brother likes to skate on the frozen pond."" This sentence includes the word ""skate"" exactly as it is, and conveys a simple idea about a child",0.79,1,skate
The kids love to swim in the cool summer water.,0.95,1,swim
The kids loved swimming in our backyard pool.,0.99,1,pool
"Here is a sentence that meets the requirements: ""My friend likes swimming in the cool ocean water."" This sentence includes the word 'swimming' exactly as it is, conveys a simple and clear idea,",0.8,1,swimming
My kids love to go swimming every summer.,1.0,1,go swimming
The kids are ready to jump into recess.,0.94,1,jump
"After considering the constraints, I came up with a sentence that meets all the requirements: ""After playing outside, take a shower at home."" This sentence is clear, simple, and easy to understand for elementary school students in the US.",0.84,1,take a shower
The paper boat will float on the lake.,1.0,1,float
The drummer played a loud beat on his drum.,0.98,1,drum
The boy picked up his guitar to play music.,0.98,1,guitar
The teacher has a piano in her classroom.,0.99,1,piano
The student plays a beautiful violin at the concert.,0.96,1,violin
The students enjoyed listening to music at recess.,0.99,1,music
The teacher gave us a musical instrument to play during recess.,0.92,1,musical
The teacher is also a talented young singer.,0.86,1,singer
The pianist practiced music every single day at home.,0.97,1,pianist
The musician played a beautiful melody on her guitar.,0.97,1,musician
The magician was an excellent entertainer at the party.,0.81,1,entertainer
The teacher chose a guitar as her instrument.,0.99,1,instrument
The teacher used a recorder to practice singing in class.,0.94,1,recorder
"Here is a sentence that meets the requirements: ""Having a talent for drawing brings joy to artists."" This sentence includes the word ""talent"" exactly as it is, and conveys a clear and simple idea about the value of",0.79,1,talent
The kids are going to a big party tonight.,0.98,1,party
The class will have a party next weekend.,1.0,1,have a party
The family went on a picnic in the park.,0.97,1,picnic
The town hosts an annual summer festival every year.,0.98,1,festival
The girl is looking forward to her friend's wedding.,0.94,1,wedding
Students will celebrate their school play performance tonight.,0.96,1,celebrate
The marching band leads a colorful procession around town.,0.96,1,procession
The water in the refrigerator feels cold.,0.97,1,cold
The teacher stood at the head of the classroom.,0.91,1,head
The bird's neck was very long and slender always.,0.82,1,neck
The boy sniffed his nose when he got cold.,0.98,1,nose
The warm sunshine makes me feel happy outside.,0.99,1,warm
The teacher gave us a bad cold yesterday.,0.99,1,bad cold
The doctor asked me if I had a sore throat.,0.96,1,sore throat
The boy touched his throat while coughing loudly outside.,0.96,1,throat
The teacher held up a mirror to her forehead.,0.97,1,forehead
The boy had a cough during his math test.,0.98,1,cough
The runner ran very fast around the track.,1.0,1,fast
The turtle moved slowly across the wet grass.,1.0,1,slow
The kids need to hurry to catch their bus.,0.97,1,hurry
The rabbit can run very quick outside today.,1.0,1,quick
The clock showed instant time on its digital face.,0.97,1,instant
The sun came out suddenly in clear blue sky.,0.98,1,suddenly
The patient teacher tried to be very impatient today.,0.96,0,impatient
The teacher made sure the classroom was very clean.,0.96,1,clean
The dirty floor needs to be cleaned today.,1.0,1,dirty
"After considering the rules carefully, I came up with this sentence: ""Please clean up your toys after playtime today."" It meets all the requirements and conveys a clear idea of tidying up after a fun activity.",0.83,1,clean up
The teacher helps students wipe their pencils clean.,0.99,1,wipe
The kids love playing outside after wash time.,0.99,1,wash
The red grape juice will leave a stain on my shirt.,0.93,1,stain
The broom helps us sweep the floor every day.,0.97,1,sweep
The water was clear in the pool after cleaning.,0.9,1,clear
The virus can infect people who are not healthy.,0.98,1,infect
It's best to wake up early in the morning.,0.88,1,early
My brother is coming home late from school today.,0.98,1,late
The fire department arrived in timely fashion to rescue everyone.,0.94,1,timely
Students will arrive at school on time tomorrow.,0.99,1,arrive
The teacher told us we have recess later.,1.0,1,later
The party will be postponed until next year's date.,0.88,1,postpone
The library book is due tomorrow morning.,0.85,1,due
The weather caused a delay in our school field trip.,0.95,1,delay
The librarian told us to be quiet in the library.,0.94,1,quiet
The kids in my neighborhood are very noisy.,0.85,1,noisy
The loud firework made a lot of noise outside.,0.97,1,noise
The firework went off loud in the night sky.,0.97,1,loud
The librarian kept the library very silent at night.,0.96,1,silent
The door will shut when I lock it up.,0.98,1,shut
The kids heard a loud sound coming from outside.,0.98,1,sound
The teacher thought it was quite an easy lesson today.,0.95,1,quite
The kids loved buying books at the bookstore.,0.99,1,bookstore
The family goes to the restaurant for dinner tonight.,0.96,1,restaurant
The teacher organized books on the bookshelf neatly tonight.,0.95,1,bookshelf
My mom likes to go to the shop sometimes.,0.97,1,shop
Students go shopping at the supermarket with their parents.,0.94,1,supermarket
Children love going shopping with their parents on weekends.,0.83,1,shopping
The bakery sells fresh bread every Saturday morning.,0.99,1,bakery
The kids are going to the store to buy toys.,0.95,1,store
My mom takes me to the clothing store.,1.0,1,clothing store
The archer aims at her target every time she shoots.,0.96,1,target
The doctor takes her patients to the hospital.,0.99,1,hospital
The ambulance came quickly to help the injured boy.,0.96,1,ambulance
The teacher called in the doctor for the school nurse.,0.9,1,doctor
The nurse gave me medicine to feel better.,1.0,1,nurse
The scientist studied the amazing birds in their habitat.,0.95,1,scientist
The kids are learning about science in their classroom today.,0.94,1,science
Eating nutritious food helps keep your overall health.,0.86,1,health
The doctor prescribed some medicine for my cold.,0.99,1,medicine
The doctor is studying a new disease treatment.,0.99,1,disease
The doctor diagnosed my friend with a bad illness.,0.97,1,illness
The doctor is also known as a physician.,0.93,1,physician
A psychologist helps people solve problems in their minds.,0.95,1,psychologist
The doctor tested my mom for cancer.,1.01,1,cancer
The doctor will prescribe medicine for your headache.,0.99,1,prescribe
The doctor gave her a new treatment plan today.,0.98,1,treatment
The doctor was very patient with her young patients.,0.84,1,patient
The students went to the library every Friday.,0.99,1,library
The librarian helped kids find their favorite books.,0.99,1,librarian
The school principal works with her secretary every day.,0.97,1,secretary
The store clerk helped me pick out some fruit.,0.98,1,clerk
The school principal works in the office every day.,0.97,1,office
The school staff helps students every single day.,1.0,1,staff
"Here is a sentence that meets the requirements: ""The school will start a new summer program tomorrow."" This sentence includes the word ""program"" exactly as it is, without any changes or additional forms. It conveys a clear",0.76,1,program
The school administration has a special department for clubs.,0.95,1,department
The company will send me a bill each month.,0.98,1,bill
Children love visiting the museum every summer vacation.,0.85,1,museum
The museum will exhibit ancient artifacts this weekend.,0.98,1,exhibit
The teacher asked students to show their work.,0.99,1,show
The teacher gave us a present on our birthday yesterday.,0.94,1,present
The flowers will begin to appear in the garden soon.,0.95,1,appear
The detective found strong evidence at the crime scene.,0.96,1,evidence
The teacher will give a presentation about our school.,0.95,1,presentation
The museum has a beautiful display of dinosaurs outside.,0.96,1,display
The teacher spoke in front of her entire audience.,0.97,1,audience
The book can help illustrate different countries around the world.,0.94,1,illustrate
The kids are going to school today after lunch.,0.98,1,school
"Here's a sentence that meets the requirements: ""Children usually attend elementary school from kindergarten age."" This sentence includes the exact phrase ""elementary school,"" is clear and simple, conveys a logical idea,",0.8,1,elementary school
"Here's a simple sentence: After high school, she will go to college.",0.9,1,college
The students visited their local university yesterday.,0.98,1,university
The children went to church on Sunday mornings.,0.99,1,church
The student needs extra help in this particular grade.,0.97,1,grade
The judge will preside over the school court today.,0.97,1,court
The intermediate school teacher gave us homework tonight.,0.96,1,intermediate
The school offers many extracurricular activities after classes.,0.97,1,extracurricular
Students are attending a school conference every year.,0.99,1,conference
The kid kicked the ball across the playground.,0.93,1,ball
The kids played badminton on Saturday afternoon.,0.99,1,badminton
The baseball team practiced every morning before school.,0.99,1,baseball
The teacher helped me practice basketball during recess today.,0.96,1,basketball
My dad loves playing golf on sunny weekends.,0.99,1,golf
The ping-pong table was set up in the gym.,0.89,1,ping-pong
My son loves playing soccer with his friends outside.,0.96,1,soccer
My favorite sport is playing soccer outside.,0.99,1,sport
The kids love playing tennis in the park.,0.99,1,tennis
The kids love playing volleyball at recess time.,0.99,1,volleyball
"Here's a sentence that meets all the requirements: ""I love playing hockey on the ice rink."" This sentence includes the word 'hockey' exactly as it is, conveys a simple idea, and uses easy",0.8,1,hockey
The kids are playing football in their backyard.,0.99,1,football
The athlete ran very fast in the big race.,0.97,1,athlete
"Here's a sentence that meets the requirements: The kids love to play outside every Saturday morning. This sentence includes the word 'play' exactly as it is, conveys a clear idea about children enjoying outdoor activities, and uses",0.79,1,play
The noise from the backcourt was a loud racket.,0.84,1,racket
The students ate their cereal from a big bowl.,0.98,1,bowl
The student carried her lunch in a wicker basket.,0.97,1,basket
The soccer team joined a local youth league.,1.01,1,league
The student reads her book every night before bed.,0.98,1,book
My teacher uses our textbook every day in class.,0.97,1,textbook
Here's a new attempt at creating an English sentence that meets all the requirements: The children loved reading their favorite storybook together.,0.87,1,storybook
"Here's a sentence that meets the requirements: Reading nonfiction books helps us learn new facts. This sentence includes the word 'nonfiction' exactly as it is, without any changes or additional forms. It conveys a",0.78,1,nonfiction
The student will read her favorite book every day.,0.97,1,read
"Here is a sentence that meets the requirements: The teacher told us a new story yesterday. This sentence includes the word ""story"" exactly as it is, conveys a clear and simple idea, and uses age-appropriate vocabulary",0.78,1,story
The little girl played with her favorite doll outside.,0.97,1,doll
The boy's favorite toy was his new robot car.,0.82,1,toy
The little boy played with his toy car outside.,0.98,1,toy car
The kids went to the toy shop to play.,0.97,1,toy shop
The boy is playing outside with his friends happily.,0.96,1,boy
The museum had an antique piano on display yesterday.,0.96,1,antique
The little bird sings a sweet melody outside.,1.0,1,bird
The farmer had a chicken in his backyard yard.,0.97,1,chicken
The chicken had a hen as its mother.,1.0,1,hen
The baseball player swung his bat at the ball.,0.97,1,bat
The chicken laid an egg in its nest yesterday.,0.97,1,egg
The children liked eating the chicken curry at school.,0.96,1,curry
The little girl gently watched a bee outside.,0.99,1,bee
The little girl petted a friendly duck outside.,0.99,1,duck
The little cat is sleeping on the soft cushion.,0.96,1,cat
The dog is very happy in the park today.,0.84,1,dog
The puppy is very happy at our new home.,0.85,1,puppy
The girl has a happy little pet cat.,1.01,1,pet
The zoo has many different kinds of animals.,0.99,1,animal
"Here's a meaningful and natural English sentence: ""When I went to the vet, my cat got checked."" This sentence includes the word 'vet' exactly as it is, without any changes or additional forms. It conveys",0.79,1,vet
The robot helps humans in many important jobs daily.,0.98,1,robot
The wolf likes to play outside in the morning.,0.96,1,wolf
The little girl rode her horse very slowly outside.,0.98,1,horse
My best pal is coming over for a playdate today.,0.95,1,pal
The little boy caught a big fish yesterday.,1.0,1,fish
The kids love fishing with their grandfather on weekends.,0.95,1,fishing
My dad likes to go fishing every Saturday morning.,0.96,1,go fishing
"Here's a sentence that meets all the criteria: ""Children love to swim at our quiet lake."" This sentence includes the word ""lake"" exactly as it is, conveys a simple idea about enjoying swimming, and",0.82,1,lake
The dog likes to poke its nose into baskets.,0.98,1,poke
The tiger is sleeping in its cozy little den.,0.98,1,tiger
The lion is sleeping in its cozy little den.,0.98,1,lion
The kids went to the zoo to see animals.,0.96,1,zoo
The big bear climbed up the tall tree quickly.,0.96,1,bear
The big elephant at the zoo was very friendly.,0.83,1,elephant
The little monkey climbed up the big tree quickly.,0.96,1,monkey
The giraffe loves to eat leaves from tall trees.,0.98,1,giraffe
"Here's a sentence that meets the requirements: ""Children love watching kangaroos hop in zoos nearby."" This sentence includes the word ""kangaroo"" exactly as it is,",0.81,1,kangaroo
The zebra ran quickly around its friends.,0.99,1,zebra
The hikers saw a beautiful white deer in the woods.,0.95,1,deer
The dolphin swam quickly in the ocean today.,0.99,1,dolphin
The animals ran wild in their new backyard home.,0.97,1,wild
The kids ate a banana at their school snack.,0.98,1,banana
The girl ate grapes at the summer picnic today.,0.97,1,grapes
The boy enjoyed eating juicy melon in the summer.,0.97,1,melon
The girl ate a juicy peach at school today.,0.98,1,peach
She ate a juicy pear as a healthy snack.,0.97,1,pear
The girl ate a sweet strawberry right from the box.,0.95,1,strawberry
The watermelon was cut into small pieces for lunch.,0.91,1,watermelon
"Here is a sentence that meets the requirements: ""The apple is a type of fruit."" This sentence includes the word 'fruit' exactly as it is, is clear and simple, conveys a logical idea, and uses",0.77,1,fruit
The fruit vendor sold me a small kiwi yesterday.,0.98,1,kiwi
The teacher added lemon juice to our favorite drink.,0.97,1,lemon
The kids enjoyed drinking fresh orange juice together.,0.99,1,juice
The teacher served grape jam on toast at breakfast.,0.97,1,jam
The fruit is orange when it's fully ripe.,0.85,1,orange
The cat wore a black collar around its neck.,0.98,1,black
The sky looks blue on a sunny day outside.,0.98,1,blue
The brown bear climbed up a big mountain.,0.99,1,brown
The flowers have different beautiful colors.,0.98,1,color
The sky turned gray on the rainy day outside.,0.97,1,gray
The grass on the playground is very green.,0.86,1,green
The ballerina wore a pink tutu to the show.,0.97,1,pink
The apple on the tree is bright red.,0.87,1,red
The teacher drew white chalk on the blackboard.,0.99,1,white
The sunflower has bright yellow petals outside.,0.99,1,yellow
