final_sentence,grammar_score,coherence_score,word
The little pig likes to play outside every day.,0.98,1,pig
The kids are eating hamburgers at the backyard barbecue.,0.96,1,hamburger
The kids at school love eating hot dogs on Fridays.,0.82,1,hot dog
The kids love eating spaghetti with their favorite sauce.,0.97,1,spaghetti
My favorite breakfast food is steaming hot noodles.,0.98,1,noodles
"Here is a sentence that meets all your requirements: ""My mom makes delicious soup for dinner tonight."" This sentence includes the word ""soup"" exactly as it is, without any changes or additional forms. It conveys a simple",0.79,1,soup
The chef likes to fry eggs in the morning.,0.97,1,fry
The child used a pan to cook her breakfast.,0.98,1,pan
The chef carefully roasted the chicken for dinner tonight.,0.95,1,roast
The teacher added ketchup sauce to the school lunch.,0.96,1,sauce
"Here's a sentence: ""My mom is making tea for our afternoon snack."" This sentence includes the word 'tea' exactly as it is, conveys a single logical idea, and uses simple vocabulary and grammar",0.82,1,tea
The teacher brings coffee for the morning class.,0.99,1,coffee
The little girl drank from her favorite cup.,1.0,1,cup
The baseball player wore a cap on his head.,0.98,1,cap
The girl filled the pot with water carefully.,0.99,1,pot
"Here's a sentence that meets your requirements: ""You need water to drink every single day."" This sentence includes the word 'water' exactly as it is, conveys a clear and simple idea about the importance of drinking water",0.8,1,water
Weather forecast said it would be cloudy today outside.,0.96,1,cloudy
"Here's a sentence that meets all your requirements: ""Let's stay inside on a rainy Saturday afternoon."" This sentence is clear, simple, and easy to understand for an elementary school student in the US. It includes",0.79,1,rainy
The rain makes puddles on the sidewalk outside.,0.98,1,rain
The child played outside on a very wet day.,0.98,1,wet
The weather was foggy when we went skiing yesterday.,0.97,1,foggy
The sidewalk looked damp after last night's rain.,0.98,1,damp
"The garden was dry after the long, hot summer.",0.85,1,dry
The ice rink was very slippery today.,0.87,1,slippery
The fairy sprinkles glitter on the birthday cake.,0.98,1,sprinkle
The camel travels slowly through the hot desert.,0.99,1,desert
The runner starts to sweat during her long run.,0.98,1,sweat
The sponge will soak up the wet paint slowly.,0.97,1,soak
Be careful not to spill the juice during recess.,0.84,1,spill
"Here is a meaningful and natural English sentence for elementary school vocabulary learning: ""Please pour me some water from the pitcher."" This sentence meets all the requirements, conveying a clear and simple idea that an elementary school student in the US can",0.79,1,pour
The teacher asked students to stand quietly during the test.,0.94,1,stand
"When it's time to leave, get up and head downstairs.",0.86,1,get up
"Here's a sentence that meets the requirements: ""Don't stay up too late on school nights."" This sentence includes the exact word ""stay up"", is clear and simple, conveys a logical idea about sleep schedules",0.81,1,stay up
The teacher told us to stand up before class.,0.98,1,stand up
The cheerleaders started doing their routine loudly outside school.,0.94,1,cheer
The picture will hang on the wall tomorrow.,0.99,1,hang
The teacher asked the kids to clap during a concert.,0.94,1,clap
The teacher asked us to shake our hands before class.,0.95,1,shake
The lamb ate its favorite foods every morning.,0.99,1,lamb
The farmer has many sheep in her green field.,0.98,1,sheep
The goat is eating grass on the farm.,1.0,1,goat
The museum has an art gallery upstairs always.,0.74,1,art gallery
The artist painted a beautiful picture of the park.,0.96,1,artist
The kids loved making art projects in class.,1.0,1,art
The cartoonist drew funny pictures every single day.,0.99,1,cartoonist
The teacher encouraged all students to be artistic.,0.98,1,artistic
The museum has an art gallery on its second floor.,0.95,1,gallery
"Here's a sentence that meets all your requirements: ""The teacher asked us to draw a picture of our pet."" This sentence is clear, simple, and easy to understand for an elementary school student in the US. It includes the",0.77,1,draw
The artist used graphic pictures in her magazine art.,0.96,1,graphic
The architect carefully designed the new school building.,0.97,1,design
Here is a sentence that meets all the requirements: You can send letters to your friends at the post office.,0.88,1,post office
The mail carrier brings letters to our house every day.,0.95,1,mail carrier
The teacher wrote a letter to your parents yesterday.,0.96,1,letter
The mailman helps me find my address.,0.99,1,address
The mailman puts a stamp on every letter today.,0.98,1,stamp
The children walked through the quiet town in the morning.,0.89,1,town
"Here's a sentence that meets the requirements: ""My hometown is where I grew up happily.",0.89,1,hometown
The children in the village went to school together.,0.96,1,village
The kids are playing in the big city.,0.99,1,city
The park is a nice place to play outside.,0.91,1,place
"Here's a sentence that meets the requirements: ""Use the map to find your way home tonight."" This sentence is clear, simple, and easy to understand for an elementary school student. It includes the word ""map"" exactly",0.78,1,map
The queen lives in a beautiful palace nearby.,1.0,1,palace
The elephant walked slowly around the ancient temple.,0.99,1,temple
The kids are visiting a beautiful island tomorrow.,0.99,1,island
The detective found the suspicious person at every spot.,0.96,1,spot
The farmer owns a big piece of land.,1.01,1,land
The parade goes through downtown every summer day.,0.99,1,downtown
The boy smiled at his friendly neighbor every morning.,0.96,1,neighbor
The teacher will measure the room's area today.,0.96,1,area
The capital of France is a beautiful city.,0.86,1,capital
The map will help us locate our classroom building.,0.97,1,locate
My friend likes playing computer games on weekends.,0.99,1,computer game
The kids are playing a fun game outside.,0.99,1,game
The student showed her library card yesterday.,0.99,1,card
The kids loved playing on the old bridge.,0.99,1,bridge
The teacher stood on the board to write notes.,0.97,1,board
My son loves playing chess with his grandfather.,0.97,1,chess
The teacher warned the student not to cheat on tests.,0.94,1,cheat
The teacher stood on the platform to greet her students.,0.94,1,platform
The school uses an efficient system for tracking attendance.,0.96,1,system
The train car was filled with steam.,0.94,1,steam
The school band will play at the concert tonight.,0.96,1,concert
The band performed in the concert hall yesterday evening.,0.95,1,concert hall
The class made an album of their favorite memories.,0.97,1,album
The prince visited his friends at school today.,0.99,1,prince
The school band is going on tour next week.,0.98,1,band
The rock in my garden needs to be watered.,0.98,1,rock
The performer stood on the stage in front of everyone.,0.94,1,stage
The students will set up their classroom before class starts.,0.95,1,set
The kids are watching their favorite movie tonight.,0.99,1,movie
The school is showing a new film tonight.,0.99,1,film
My brother watches television after dinner every night.,0.99,1,television
The kids are performing in the school theater tonight.,0.96,1,theater
The teacher used tape to fix the broken bookshelf.,0.96,1,tape
The teacher uses a step-by-step method to teach new students.,0.9,1,method
The school uses multimedia in its educational programs daily.,0.95,1,multimedia
The kids will build their own LEGO castle today.,0.98,1,build
The school has a big building on its campus.,0.98,1,building
The kids played outside under the big roof.,0.99,1,roof
The tallest building in the city has a tower.,0.96,1,tower
"This sentence includes the word ""foundation"" exactly as it is, without any changes or additional forms. It conveys a single, logical idea about how the school's foundation supports student learning, making it clear, simple, and",0.8,1,foundation
"Here's a sentence that meets the requirements: ""I need to buy some new pencils today."" This sentence includes the word 'buy' exactly as it is, without any changes or additional forms. It conveys a single",0.79,1,buy
The store owner will sell toys at the sale.,0.97,1,sell
The store had a sale on summer toys last week.,0.96,1,sale
"Here is a sentence that meets the requirements: ""After saving up, Emma made her first purchase."" This sentence includes the word ""purchase"" exactly as it is, without any changes or additional forms. It conveys a single idea about",0.79,1,purchase
The farmer sells his fruits at the market today.,0.97,1,market
The pizza delivery man kept our order in his truck.,0.95,1,order
The school needs more books due to the growing demand.,0.95,1,demand
The company made many useful products every year.,0.99,1,product
The school has a supply of pencils for students.,0.97,1,supply
The teacher picked out an item from her bag.,0.98,1,item
You can find a new pencil in your desk drawer.,0.96,1,find
The librarian will help us search for new books.,0.98,1,search
What time will you ask your teacher to meet?,0.98,1,ask
"Here is a sentence that meets the requirements: ""Please check your homework before you turn it in."" This sentence includes the word ""check"" exactly as it is, and conveys a clear and simple idea about checking homework before submitting",0.81,1,check
The little girl will beg her mom for cookies.,0.98,1,beg
The students will seek help from their teacher outside.,0.96,1,seek
The students will pray together before their big test.,0.97,1,pray
The teacher said look at the picture on the board.,0.89,1,look
The teacher asked us not to stare at our phones.,0.95,1,stare
The teacher will watch us during recess carefully.,0.99,1,watch
The kids will see the fireworks at night.,0.99,1,see
The picture of the cat looks like a little ball.,0.95,1,look like
The teacher wants her students to perceive their surroundings carefully.,0.92,1,perceive
It is also within the 6-10 word limit and remains contextually coherent for an audience of about a dozen words.,0.82,1,want
The student needs a pencil to write in class.,0.98,1,need
The teacher will have us write our names on the paper.,0.92,1,have
"Here is a sentence that meets the requirements: ""You have to turn off the lights when leaving."" This sentence includes the word ""have to"" exactly as it is, conveys a clear and logical idea, and uses simple vocabulary",0.8,1,have to
You need to get your backpack from the lost room.,0.95,1,get
You must always wear a seatbelt while riding a bike.,0.95,1,must
The school had a lack of pencils in the classroom.,0.94,1,lack
The dog will possess the favorite toy soon.,0.99,1,possess
Having enough food is a great necessity.,0.87,1,necessity
My family likes to go camping every summer vacation.,0.97,1,camping
Students love going hiking in the nearby woods.,1.0,1,hiking
"Here is a sentence that meets the requirements: ""My friends and I are going camping this weekend."" This sentence includes the phrase ""go camping"" exactly as it is, conveys a clear and simple idea, and uses age-appropri",0.79,1,go camping
My friends and I like to go hiking on weekends.,0.95,1,go hiking
The family loves to go on a hike together.,0.98,1,hike
The class went on a fun tour of the museum.,0.95,1,tour
The police officer stopped the curious tourist on the street.,0.88,1,tourist
The hikers enjoyed the beautiful scenery of the mountains.,0.9,1,scenery
"The sentence that meets the requirements: ""The family enjoyed going on sightseeing in Hawaii."" This sentence includes the word 'sightseeing' exactly as it is, without any changes or additional forms. It conveys a clear and concise",0.76,1,sightseeing
We are going on holiday to the beach next week.,0.95,1,holiday
The family is going on vacation next week.,1.0,1,vacation
My friend is having her birthday party tomorrow.,0.99,1,birthday
The sun shines brightly on every sunny day.,1.0,1,day
The kids took a break outside in the sunshine.,0.96,1,break
The school staff meets biweekly to plan new projects.,0.97,1,biweekly
The teacher gave us a new plant to care for today.,0.93,1,plant
The teacher took us to her beautiful garden outside.,0.96,1,garden
The teacher gave each child a flower to wear.,0.98,1,flower
The girl put the small vase on the table.,0.92,1,vase
The kids played outside on the green grass.,0.99,1,grass
Planting a new seed can make a garden grow.,0.97,1,seed
The greenhouse helps plants grow in warm weather conditions.,0.96,1,greenhouse
Plants need good soil to grow strong roots.,1.01,1,soil
The chef will cook dinner tonight for everyone.,0.99,1,cook
"Here is a sentence that meets the requirements: ""My mom likes to bake cookies every weekend."" This sentence includes the word ""bake"" exactly as it is, conveys a clear and simple idea, and uses age-appropri",0.81,1,bake
The students can make their own art project today.,0.97,1,make
The baker made delicious treats for the happy customers.,0.96,1,baker
The water needs to boil before we can drink it.,0.96,1,boil
The ice cream will start to melt outside.,1.0,1,melt
"Here's a sentence that meets the requirements: ""Let's follow the recipe to make a delicious cake."" This sentence includes the word ""recipe,"" is clear and simple, conveys a logical idea about making",0.79,1,recipe
The teacher will stir the batter before pouring it into cups.,0.92,1,stir
The kids ran to their house after school.,1.01,1,house
My mom helps me clean the kitchen every day.,0.98,1,kitchen
"Here's a sentence that meets the requirements: ""The family uses their household for storage."" This sentence includes the word 'household' exactly as it is, and conveys a clear and simple idea about where a family",0.78,1,household
"Here is a sentence that meets the requirements: ""After dinner, she washed the dish and put it away."" This sentence includes the word ""dish"" exactly as it is, conveys a clear idea, uses simple vocabulary",0.8,1,dish
"Here is a sentence that meets the requirements: The mom cooks dinner on the stove today. This sentence includes the word 'stove', conveys a clear and simple idea about cooking, and uses language that is easy",0.79,1,stove
The girl put her food on the plate.,1.0,1,plate
"Here's a sentence that meets all your requirements: ""When we moved into our new house, it was a housewarming party."" This sentence is clear, simple, and easy to understand for an elementary school student. It includes",0.79,1,housewarming
The dirty dish will eventually sink in the dishwasher.,0.96,1,sink
The water in the bathtub will slowly drain down.,0.97,1,drain
The kids went swimming in the river yesterday.,0.92,1,river
The kids love to dig in the sandbox outside.,0.96,1,dig
The paper can bleed through if it's too thin.,0.95,1,bleed
The water in the fountain starts to flow.,0.99,1,flow
Children often bury small treasures in the backyard garden.,0.96,1,bury
The kids ran quickly down the stairs to recess.,0.97,1,stairs
The child climbed up the big stair to her room.,0.95,1,stair
The hikers climbed the mountain to see the view.,0.91,1,mountain
Children love playing at the top of the hill.,0.96,1,hill
"Here's a sentence that meets all your requirements: ""The child carefully picked up a big stone."" This sentence includes the word 'stone' exactly as it is, conveys a clear and simple idea, and uses easy",0.8,1,stone
The tree branch will bend when it touches the ground.,0.95,1,bend
The kids love to climb up the jungle gym.,0.97,1,climb
My best friend helped me build a new birdhouse.,0.98,1,friend
"Here is a sentence that meets the requirements: ""My mom shows kindness to everyone in our family."" This sentence includes the word ""kindness"" exactly as it is, is clear and simple, conveys a single logical idea,",0.8,1,kindness
"Here's a sentence that meets all the requirements: ""Having good friendship is very important in life."" This sentence conveys a clear and logical idea about the value of friendship, using simple vocabulary and grammar that elementary school students can",0.8,1,friendship
The teacher was kind to her students every day.,0.84,1,kind
My mom loves making yummy breakfast for me every morning.,0.95,1,love
The teacher showed respect for all students in her class.,0.94,1,respect
The police officer approached a suspicious stranger on the street.,0.93,1,stranger
"Here's a sentence that meets the requirements: ""My teacher is very friendly and helpful always."" This sentence includes the word ""friendly"" exactly as it is, conveys a clear idea about the teacher's personality, and uses",0.79,1,friendly
"Here is a 7-word sentence: ""My teacher is someone I admire greatly."" This sentence includes the word ""admire"" exactly as it is, uses simple vocabulary and grammar suitable for elementary school students, and conveys a clear",0.8,1,admire
She began to distrust her new neighbor right away.,0.97,1,distrust
The teacher gave us a fun math worksheet today.,0.97,1,teacher
The teacher wrote on the blackboard in her classroom.,0.96,1,classroom
The students will have recess after their class.,1.0,1,class
Here's a sentence that meets the requirements: My classmate shared her pencil with me yesterday.,0.88,1,classmate
The teacher helps the student learn new math facts daily.,0.94,1,student
The teacher will teach us how to use pencils.,0.97,1,teach
Students go to school to receive education every day.,0.96,1,education
The teacher was an experienced instructor at school.,0.84,1,instructor
The professor taught us about dinosaurs yesterday.,0.99,1,professor
"Here's a sentence that meets the requirements: ""My teacher wants to educate all her students well."" This sentence is clear, simple, and easy to understand for an elementary school student in the US. It includes the word 'e",0.78,1,educate
"Here's a sentence that meets all the requirements: ""The teacher gave us a lesson on fractions today."" This sentence is clear, simple, and easy to understand for an elementary school student in the US. It conveys the",0.77,1,lesson
The principal of our school is very nice.,0.87,1,principal
The teacher gave us nice pencils to color.,0.99,1,nice
The new water slide looks really cool at summer camp.,0.96,1,cool
The museum exhibit was interesting and very fun to see.,0.86,1,interesting
The teacher gave us a sweet treat after class.,0.98,1,sweet
The teacher found the classroom very neat today.,0.99,1,neat
Your friend will be sure to meet you at recess.,0.89,1,sure
The rope was tight around the big heavy box.,0.84,1,tight
The teacher assigned a new course on American history.,0.96,1,course
The bad weather made it difficult to play outside.,0.96,1,bad
"The movie was terrible, but I liked the animals.",0.97,1,terrible
The poor man had very little money to spend.,0.98,1,poor
"Here's a sentence that meets all your requirements: ""When I share my toys, it makes me better friends."" This sentence includes the word 'better' exactly as it is, and it conveys a simple idea about",0.8,1,better
"Here is one example: She wore very pretty yellow shoes yesterday. This sentence includes the word 'very' exactly as it is, without any changes or additional forms, and conveys the meaning of the word 'very' exactly as",0.79,1,very
The rich man had many beautiful animals.,0.99,1,rich
"Here is a sentence that meets the requirements: ""Emily saved her money for a new bike.""",0.84,1,money
The store will only accept cash at the checkout counter.,0.94,1,cash
The rich family had more wealth than they could use.,0.96,1,wealth
"The child found a penny, which was a coin.",0.98,1,coin
The company will pay its employees every month.,0.99,1,pay
"Here is a meaningful and natural English sentence for elementary school vocabulary learning: ""The family's income helps them pay their rent."" This sentence meets all the requirements, including using the word ""income"" exactly as it is, conveying the",0.79,1,income
The country's economy is based on trade and exports.,0.87,1,economy
The company will invest in new computers for the school.,0.94,1,invest
The city council raised taxes to improve the roads.,0.96,1,tax
The government provides social welfare to its citizens.,0.98,1,welfare
The rabbit was very greedy and ate all the carrots.,0.88,1,greedy
The smart student won first prize in her class.,0.98,1,smart
The clever boy solved the tricky math problem quickly.,0.96,1,clever
The nurse told my mom I'm going to be sick tomorrow.,0.9,1,sick
The teacher wrote down her idea on the blackboard.,0.96,1,idea
The teacher helps students manage their mental work.,0.99,1,mental
The new car is a classic American muscle vehicle.,0.83,1,classic
The ballerina's elegant movements impressed her audience every time.,0.93,1,elegant
The storybook character was very foolish at times.,0.85,1,foolish
The boy thought his friend was a total fool.,0.98,1,fool
The firefighter was brave in the burning building.,0.9,1,brave
The wise old owl taught us how to read.,0.98,1,wise
"Here's a sentence that meets your requirements: ""I told my mom frankly what I really think."" This sentence is clear and simple, using vocabulary and grammar suitable for elementary school students in the US. It conveys a logical",0.78,1,frankly
It uses simple vocabulary and grammar that an elementary school student in the US can understand.,0.89,1,immoral
The decision not to spend money is considered irrational sometimes.,0.87,1,irrational
The mean teacher was very cruel to her students.,0.84,1,cruel
My brother thinks his silly dance is very funny.,0.98,1,silly
The rabbit likes to eat crunchy carrot sticks.,1.0,1,carrot
"Here's a sentence that meets the requirements: ""The recipe includes one big potato in the soup."" This sentence includes the word 'potato' exactly as it is, is clear and simple, conveys a single word",0.79,1,potato
The salad included a ripe tomato from our garden.,0.98,1,tomato
My mom buys carrots as our daily vegetable.,0.99,1,vegetable
"Here's a sentence that meets the requirements: ""We carved a big pumpkin on Halloween night."" This sentence is clear, simple, and easy to understand for elementary school students in the US. It includes the word 'pu",0.78,1,pumpkin
My mom makes me eat salad every day.,1.01,1,salad
The kids loved eating French fries at the ballpark.,0.97,1,French fries
"Here is a sentence that meets the requirements: ""My mother is cooking an onion on the stove.""",0.84,1,onion
The sunflower grows very tall in warm weather.,0.99,1,sunflower
The sunset looked beautiful in the clear sky tonight.,0.96,1,beautiful
The kitten's little face was very cute.,0.87,1,cute
The teacher gave us a good book to read at home.,0.93,1,good
The handsome boy was smiling at his friends outside.,0.96,1,handsome
The girl thought her friend's new dress was pretty.,0.95,1,pretty
The fireworks display was wonderful every summer evening.,0.85,1,wonderful
The teacher gave an excellent math test to her students.,0.94,1,excellent
The fireworks display was great at the summer festival tonight.,0.8,1,great
"Here's a sentence that meets your requirements: ""My friend said okay when I asked her to play."" This sentence includes the word 'okay' exactly as it is, conveys a simple idea of someone agreeing,",0.82,1,okay
The flowers in our garden are lovely today.,0.87,1,lovely
The fireworks display was amazing last night outside.,0.85,1,amazing
The teacher gave us a fine art project to do.,0.95,1,fine
The teacher gave a perfect score to my drawing.,0.96,1,perfect
The fireworks show was terrific last night outside.,0.85,1,terrific
The fireworks display was truly extraordinary last night.,0.84,1,extraordinary
The fireworks display was truly incredible last night outside.,0.83,1,incredible
The new puppy is an attractive friend to have.,0.91,1,attractive
My mom said my homemade cookies are delicious.,0.98,1,delicious
The teacher was pleased with her students' good behavior.,0.83,1,pleased
The best part of school is playing outside with friends.,0.94,1,best
The teacher helped us become able readers quickly.,0.99,1,able
The teacher told us that honesty is always honest.,0.97,1,honest
The teacher was sincere when she helped her students.,0.96,1,sincere
The teacher gave us straight lines to draw today.,0.97,1,straight
"Here's a sentence that meets the requirements: ""I really love playing soccer in the sunshine."" This sentence includes the word ""really"" exactly as it is, conveys a clear and simple idea, and uses age-appropri",0.8,1,really
The teacher is taking the situation very seriously.,0.98,1,serious
Eating two slices of pizza per day is reasonable.,0.84,1,reasonable
Here is a sentence that meets the requirements: The teacher explained the lesson clearly to the class.,0.84,1,clearly
The teacher uses a soft brush to paint the wall.,0.95,1,brush
She puts toothpaste on her brush every morning.,0.99,1,toothpaste
"Here is a sentence that meets the requirements: ""After taking a bath, she used soap on her skin."" This sentence includes the word 'soap' exactly as it is, conveys a clear and simple idea",0.8,1,soap
The scientist studied the properties of a chemical reaction.,0.95,1,chemical
The teacher used powder to make her makeup last longer.,0.95,1,powder
The kids played outside on the sunny road.,0.99,1,road
Children play on the sidewalk of the street.,0.99,1,street
What is your name on your identification card?,0.84,1,name
The pencil lies on the straight line.,0.99,1,line
The school bus takes a familiar route every morning.,0.97,1,route
The kids loved playing in the snowy park today.,0.97,1,snowy
The kids loved playing outside in the spring.,0.99,1,spring
The kids love playing outside during the summer.,0.99,1,summer
The leaves will fall from the tree in autumn.,0.97,1,fall
